<?xml version="1.0" encoding="UTF-8"?>
<xs:schema xmlns:xs="http://www.w3.org/2001/XMLSchema"
    xmlns:asp="http://dda.dk/ddi/advanced-search-parameters"  xmlns:smd="http://dda.dk/ddi/search-metadata"  xmlns:s="http://dda.dk/ddi/scope" targetNamespace="http://dda.dk/ddi/advanced-search-parameters" elementFormDefault="qualified">
    
    <xs:import namespace="http://dda.dk/ddi/search-metadata" schemaLocation="search-metadata.xsd"/>
    <xs:import namespace="http://dda.dk/ddi/scope" schemaLocation="scope.xsd"/>
    
    <xs:element name="AdvancedSearchParameters" type="asp:AdvancedSearchParametersType" />
    
    <xs:complexType name="AdvancedSearchParametersType">
        <xs:sequence>
            <xs:element name="studyId" type="xs:string" minOccurs="0" maxOccurs="1"/>
            <xs:element name="title" type="xs:string" minOccurs="0" maxOccurs="1"/>
            <xs:choice>
                <xs:element name="topicalCoverage" type="xs:string" minOccurs="0" maxOccurs="unbounded"/>
                <xs:sequence>
                    <xs:element name="subject" type="xs:string" minOccurs="0" maxOccurs="unbounded"/>
                    <xs:element name="keyword" type="xs:string" minOccurs="0" maxOccurs="unbounded"/>
                </xs:sequence>
            </xs:choice>
            <xs:element name="spatialCoverage" type="xs:string" minOccurs="0" maxOccurs="1"/>
            <xs:element name="abstract-purpose" type="xs:string" minOccurs="0" maxOccurs="1"/>
            <xs:element name="creator" type="xs:string" minOccurs="0" maxOccurs="1"/>
            <xs:element name="kindOfData" type="xs:string" minOccurs="0" maxOccurs="1"/>
            <xs:element name="coverageFrom" type="xs:date" minOccurs="0" maxOccurs="1"/>
            <xs:element name="coverageTo" type="xs:date" minOccurs="0" maxOccurs="1"/>
            <xs:element name="Variable" type="xs:string" minOccurs="0" maxOccurs="1"/>
            <xs:element name="QuestionItem" type="xs:string" minOccurs="0" maxOccurs="1"/>
            <xs:element name="MultipleQuestionItem" type="xs:string" minOccurs="0" maxOccurs="1"/>
            <xs:element name="Universe" type="xs:string" minOccurs="0" maxOccurs="1"/>
            <xs:element name="Concept" type="xs:string" minOccurs="0" maxOccurs="1"/>
            <xs:element name="Category" type="xs:string" minOccurs="0" maxOccurs="1"/>
            
            <xs:element ref="smd:SearchMetaData" minOccurs="1" maxOccurs="1" />
            <xs:element ref="s:Scope" minOccurs="1" maxOccurs="1" />
        </xs:sequence>
    </xs:complexType>
    
</xs:schema>